{
  "$schema": "./approved-species.schema.json",
  "schema_version": "invatrace.approved-species.v1",
  "catalogue_version": "2.0.0",
  "reviewed_at": "2026-09-08",
  "jurisdiction": "Malaysia",
  "record_count": 32,
  "records": [
    {
      "species_id": "acacia-auriculiformis",
      "scientific_name": "Acacia auriculiformis",
      "common_names": ["Earleaf acacia"],
      "malaysia_status": "Present",
      "evidence_source_ids": ["mybis-08793"],
      "evidence_summary": "The MyBIS invasive-plant record lists occurrence in Perak, Selangor and Terengganu.",
      "habitats": ["terrestrial"],
      "water_dispersed": false,
      "status_reviewed_at": "2026-09-08"
    },
    {
      "species_id": "acacia-mangium",
      "scientific_name": "Acacia mangium",
      "common_names": ["Mangium"],
      "malaysia_status": "Present",
      "evidence_source_ids": ["doa-ias-2025"],
      "evidence_summary": "The Department of Agriculture Malaysia factsheet records the species in Peninsular Malaysia, Sabah and Sarawak.",
      "habitats": ["terrestrial"],
      "water_dispersed": false,
      "status_reviewed_at": "2026-09-08"
    },
    {
      "species_id": "arachis-pintoi",
      "scientific_name": "Arachis pintoi",
      "common_names": ["Pinto peanut"],
      "malaysia_status": "Present",
      "evidence_source_ids": ["mybis-31095"],
      "evidence_summary": "The MyBIS invasive-plant record lists occurrence in the Federal Territory of Putrajaya.",
      "habitats": ["terrestrial"],
      "water_dispersed": false,
      "status_reviewed_at": "2026-09-08"
    },
    {
      "species_id": "asclepias-curassavica",
      "scientific_name": "Asclepias curassavica",
      "common_names": ["Tropical milkweed", "Bloodflower"],
      "malaysia_status": "Present",
      "evidence_source_ids": ["griis-91528"],
      "evidence_summary": "GRIIS Malaysia marks the species invasive, alien and present in Malaysia.",
      "habitats": ["terrestrial"],
      "water_dispersed": false,
      "status_reviewed_at": "2026-09-08"
    },
    {
      "species_id": "bidens-pilosa",
      "scientific_name": "Bidens pilosa",
      "common_names": ["Beggarticks", "Blackjack"],
      "malaysia_status": "Present",
      "evidence_source_ids": ["griis-91537"],
      "evidence_summary": "GRIIS Malaysia marks the species invasive, alien and present in Malaysia.",
      "habitats": ["terrestrial"],
      "water_dispersed": false,
      "status_reviewed_at": "2026-09-08"
    },
    {
      "species_id": "calopogonium-mucunoides",
      "scientific_name": "Calopogonium mucunoides",
      "common_names": ["Calopo"],
      "malaysia_status": "Present",
      "evidence_source_ids": ["griis-91550"],
      "evidence_summary": "GRIIS Malaysia marks the species invasive, alien and present in Malaysia.",
      "habitats": ["terrestrial"],
      "water_dispersed": false,
      "status_reviewed_at": "2026-09-08"
    },
    {
      "species_id": "cecropia-peltata",
      "scientific_name": "Cecropia peltata",
      "common_names": ["Trumpet tree"],
      "malaysia_status": "Present",
      "evidence_source_ids": ["griis-91557"],
      "evidence_summary": "GRIIS Malaysia marks the species invasive, alien and present in Malaysia.",
      "habitats": ["terrestrial"],
      "water_dispersed": false,
      "status_reviewed_at": "2026-09-08"
    },
    {
      "species_id": "chromolaena-odorata",
      "scientific_name": "Chromolaena odorata",
      "common_names": ["Siam weed"],
      "malaysia_status": "Present",
      "evidence_source_ids": ["griis-91571"],
      "evidence_summary": "GRIIS Malaysia marks the species invasive, alien and present in Malaysia.",
      "habitats": ["terrestrial"],
      "water_dispersed": false,
      "status_reviewed_at": "2026-09-08"
    },
    {
      "species_id": "cleome-rutidosperma",
      "scientific_name": "Cleome rutidosperma",
      "common_names": ["Fringed spiderflower"],
      "malaysia_status": "Present",
      "evidence_source_ids": ["mybis-33864"],
      "evidence_summary": "The MyBIS invasive-plant record lists occurrence in the Federal Territory of Kuala Lumpur.",
      "habitats": ["terrestrial"],
      "water_dispersed": false,
      "status_reviewed_at": "2026-09-08"
    },
    {
      "species_id": "cynodon-dactylon",
      "scientific_name": "Cynodon dactylon",
      "common_names": ["Bermuda grass"],
      "malaysia_status": "Present",
      "evidence_source_ids": ["griis-91612"],
      "evidence_summary": "GRIIS Malaysia marks the species invasive, alien and present in Malaysia.",
      "habitats": ["terrestrial"],
      "water_dispersed": false,
      "status_reviewed_at": "2026-09-08"
    },
    {
      "species_id": "cyperus-rotundus",
      "scientific_name": "Cyperus rotundus",
      "common_names": ["Purple nutsedge"],
      "malaysia_status": "Present",
      "evidence_source_ids": ["griis-91613"],
      "evidence_summary": "GRIIS Malaysia marks the species invasive, alien and present in Malaysia in terrestrial and freshwater habitats.",
      "habitats": ["terrestrial", "freshwater"],
      "water_dispersed": false,
      "status_reviewed_at": "2026-09-08"
    },
    {
      "species_id": "eichhornia-crassipes",
      "scientific_name": "Eichhornia crassipes",
      "common_names": ["Water hyacinth"],
      "malaysia_status": "Present",
      "evidence_source_ids": ["griis-91626", "sabah-biodiversity-strategy"],
      "evidence_summary": "GRIIS Malaysia marks the species invasive, alien and present in freshwater; the Sabah strategy also records it in Sabah.",
      "habitats": ["freshwater"],
      "water_dispersed": true,
      "status_reviewed_at": "2026-09-08"
    },
    {
      "species_id": "eleusine-indica",
      "scientific_name": "Eleusine indica",
      "common_names": ["Goosegrass"],
      "malaysia_status": "Present",
      "evidence_source_ids": ["mybis-17187"],
      "evidence_summary": "The MyBIS invasive-plant record lists occurrence in Johor, Pahang, Selangor and Putrajaya.",
      "habitats": ["terrestrial"],
      "water_dispersed": false,
      "status_reviewed_at": "2026-09-08"
    },
    {
      "species_id": "impatiens-balsamina",
      "scientific_name": "Impatiens balsamina",
      "common_names": ["Garden balsam"],
      "malaysia_status": "Present",
      "evidence_source_ids": ["mybis-55581"],
      "evidence_summary": "The MyBIS invasive-plant record lists occurrence in Selangor and Putrajaya.",
      "habitats": ["terrestrial"],
      "water_dispersed": false,
      "status_reviewed_at": "2026-09-08"
    },
    {
      "species_id": "leucaena-leucocephala",
      "scientific_name": "Leucaena leucocephala",
      "common_names": ["Leucaena", "White leadtree"],
      "malaysia_status": "Present",
      "evidence_source_ids": ["doa-ias-2025"],
      "evidence_summary": "The Department of Agriculture Malaysia factsheet records the species in Peninsular Malaysia, Sabah and Sarawak.",
      "habitats": ["terrestrial"],
      "water_dispersed": false,
      "status_reviewed_at": "2026-09-08"
    },
    {
      "species_id": "limnocharis-flava",
      "scientific_name": "Limnocharis flava",
      "common_names": ["Yellow bur-head"],
      "malaysia_status": "Present",
      "evidence_source_ids": ["griis-91685"],
      "evidence_summary": "GRIIS Malaysia marks the species invasive, alien and present in freshwater in Malaysia.",
      "habitats": ["freshwater"],
      "water_dispersed": true,
      "status_reviewed_at": "2026-09-08"
    },
    {
      "species_id": "megathyrsus-maximus",
      "scientific_name": "Megathyrsus maximus",
      "accepted_scientific_name": "Panicum maximum",
      "common_names": ["Guinea grass"],
      "malaysia_status": "Present",
      "evidence_source_ids": ["griis-91698"],
      "evidence_summary": "GRIIS Malaysia marks the recorded taxon invasive, alien and present; its record gives Panicum maximum as acceptedNameUsage.",
      "habitats": ["terrestrial"],
      "water_dispersed": false,
      "status_reviewed_at": "2026-09-08"
    },
    {
      "species_id": "mikania-micrantha",
      "scientific_name": "Mikania micrantha",
      "common_names": ["Mile-a-minute weed"],
      "malaysia_status": "Present",
      "evidence_source_ids": ["griis-91702", "doa-ias-2025"],
      "evidence_summary": "GRIIS Malaysia and the Department of Agriculture Malaysia both record the species as invasive and present.",
      "habitats": ["terrestrial"],
      "water_dispersed": false,
      "status_reviewed_at": "2026-09-08"
    },
    {
      "species_id": "mimosa-diplotricha",
      "scientific_name": "Mimosa diplotricha",
      "common_names": ["Giant sensitive plant"],
      "malaysia_status": "Present",
      "evidence_source_ids": ["griis-91704", "mybis-10611"],
      "evidence_summary": "GRIIS Malaysia marks the species invasive and present; MyBIS lists occurrence in Pahang.",
      "habitats": ["terrestrial"],
      "water_dispersed": false,
      "status_reviewed_at": "2026-09-08"
    },
    {
      "species_id": "mimosa-pigra",
      "scientific_name": "Mimosa pigra",
      "common_names": ["Giant mimosa"],
      "malaysia_status": "Present",
      "evidence_source_ids": ["griis-91705", "doa-ias-2025"],
      "evidence_summary": "GRIIS Malaysia and the Department of Agriculture Malaysia both record the species as invasive and present.",
      "habitats": ["terrestrial"],
      "water_dispersed": false,
      "status_reviewed_at": "2026-09-08"
    },
    {
      "species_id": "oxalis-corniculata",
      "scientific_name": "Oxalis corniculata",
      "common_names": ["Creeping woodsorrel"],
      "malaysia_status": "Present",
      "evidence_source_ids": ["griis-91728"],
      "evidence_summary": "GRIIS Malaysia marks the species invasive, alien and present in Malaysia.",
      "habitats": ["terrestrial"],
      "water_dispersed": false,
      "status_reviewed_at": "2026-09-08"
    },
    {
      "species_id": "parthenium-hysterophorus",